[
  {
    "test_id": "TP-SAST-001",
    "category": "SAST",
    "subcategory": "SQL Injection",
    "language_or_ecosystem": "Python",
    "file_path": "sast/python/sqli_endpoint.py",
    "line_number": 12,
    "vulnerability_description": "Direct f-string concatenation of untrusted user input into SQLite query",
    "expected_detection": "SQL Injection",
    "expected_severity": "HIGH",
    "cwe_or_cve": "CWE-89",
    "authoritative_reference": "https://cwe.mitre.org/data/definitions/89.html",
    "preconditions": "Source code repository scan",
    "why_vulnerable": "Attacker can inject ' OR '1'='1 to dump table",
    "reproduction_instructions": "Trigger payload via standard HTTP request or execution",
    "known_scanner_limitations": "None"
  },
  {
    "test_id": "TP-SAST-002",
    "category": "SAST",
    "subcategory": "Command Injection",
    "language_or_ecosystem": "Python",
    "file_path": "sast/python/command_injection.py",
    "line_number": 12,
    "vulnerability_description": "User input concatenated into shell command with shell=True",
    "expected_detection": "Command Injection",
    "expected_severity": "CRITICAL",
    "cwe_or_cve": "CWE-78",
    "authoritative_reference": "https://cwe.mitre.org/data/definitions/78.html",
    "preconditions": "Source code repository scan",
    "why_vulnerable": "Host parameter can execute arbitrary shell commands via ; or |",
    "reproduction_instructions": "Trigger payload via standard HTTP request or execution",
    "known_scanner_limitations": "None"
  },
  {
    "test_id": "TP-SAST-003",
    "category": "SAST",
    "subcategory": "SSRF",
    "language_or_ecosystem": "Python",
    "file_path": "sast/python/ssrf_webhook.py",
    "line_number": 12,
    "vulnerability_description": "Untrusted URL fetched directly by server without validation",
    "expected_detection": "Server-Side Request Forgery",
    "expected_severity": "HIGH",
    "cwe_or_cve": "CWE-918",
    "authoritative_reference": "https://cwe.mitre.org/data/definitions/918.html",
    "preconditions": "Source code repository scan",
    "why_vulnerable": "Attacker can supply http://169.254.169.254 to access cloud metadata",
    "reproduction_instructions": "Trigger payload via standard HTTP request or execution",
    "known_scanner_limitations": "None"
  },
  {
    "test_id": "TP-SAST-004",
    "category": "SAST",
    "subcategory": "Path Traversal",
    "language_or_ecosystem": "Python",
    "file_path": "sast/python/path_traversal.py",
    "line_number": 12,
    "vulnerability_description": "os.path.join with user-supplied filename enables directory traversal",
    "expected_detection": "Path Traversal",
    "expected_severity": "HIGH",
    "cwe_or_cve": "CWE-22",
    "authoritative_reference": "https://cwe.mitre.org/data/definitions/22.html",
    "preconditions": "Source code repository scan",
    "why_vulnerable": "Passing ../../../etc/passwd reads arbitrary system files",
    "reproduction_instructions": "Trigger payload via standard HTTP request or execution",
    "known_scanner_limitations": "None"
  },
  {
    "test_id": "TP-SAST-005",
    "category": "SAST",
    "subcategory": "Insecure Deserialization",
    "language_or_ecosystem": "Python",
    "file_path": "sast/python/insecure_deserialization.py",
    "line_number": 14,
    "vulnerability_description": "Untrusted base64 payload passed to pickle.loads",
    "expected_detection": "Insecure Deserialization",
    "expected_severity": "CRITICAL",
    "cwe_or_cve": "CWE-502",
    "authoritative_reference": "https://cwe.mitre.org/data/definitions/502.html",
    "preconditions": "Source code repository scan",
    "why_vulnerable": "Pickle bytecode executes __reduce__ resulting in arbitrary RCE",
    "reproduction_instructions": "Trigger payload via standard HTTP request or execution",
    "known_scanner_limitations": "None"
  },
  {
    "test_id": "TP-SAST-006",
    "category": "SAST",
    "subcategory": "SSTI",
    "language_or_ecosystem": "Python",
    "file_path": "sast/python/ssti_handler.py",
    "line_number": 12,
    "vulnerability_description": "User input rendered as Jinja2 template string",
    "expected_detection": "Server-Side Template Injection",
    "expected_severity": "HIGH",
    "cwe_or_cve": "CWE-1336",
    "authoritative_reference": "https://cwe.mitre.org/data/definitions/1336.html",
    "preconditions": "Source code repository scan",
    "why_vulnerable": "Passing {{ self.__init__.__globals__.__builtins__.__import__('os').popen('id').read() }} executes code",
    "reproduction_instructions": "Trigger payload via standard HTTP request or execution",
    "known_scanner_limitations": "None"
  },
  {
    "test_id": "TP-SAST-007",
    "category": "SAST",
    "subcategory": "Weak Cryptography",
    "language_or_ecosystem": "Python",
    "file_path": "sast/python/weak_crypto_tls.py",
    "line_number": 6,
    "vulnerability_description": "MD5 hashing used for security-sensitive password handling",
    "expected_detection": "Weak Hashing Algorithm",
    "expected_severity": "MEDIUM",
    "cwe_or_cve": "CWE-327",
    "authoritative_reference": "https://cwe.mitre.org/data/definitions/327.html",
    "preconditions": "Source code repository scan",
    "why_vulnerable": "MD5 is cryptographically broken and vulnerable to collision/rainbow table attacks",
    "reproduction_instructions": "Trigger payload via standard HTTP request or execution",
    "known_scanner_limitations": "None"
  },
  {
    "test_id": "TP-SAST-008",
    "category": "SAST",
    "subcategory": "Insecure TLS",
    "language_or_ecosystem": "Python",
    "file_path": "sast/python/weak_crypto_tls.py",
    "line_number": 10,
    "vulnerability_description": "requests.get with verify=False disables TLS certificate verification",
    "expected_detection": "Disabled TLS Verification",
    "expected_severity": "MEDIUM",
    "cwe_or_cve": "CWE-295",
    "authoritative_reference": "https://cwe.mitre.org/data/definitions/295.html",
    "preconditions": "Source code repository scan",
    "why_vulnerable": "Allows Man-In-The-Middle (MITM) network attacks",
    "reproduction_instructions": "Trigger payload via standard HTTP request or execution",
    "known_scanner_limitations": "None"
  },
  {
    "test_id": "TP-SAST-009",
    "category": "SAST",
    "subcategory": "Race Condition",
    "language_or_ecosystem": "Python",
    "file_path": "sast/python/race_condition_toctou.py",
    "line_number": 12,
    "vulnerability_description": "Time-of-check to time-of-use balance check allows double spending",
    "expected_detection": "Race Condition / TOCTOU",
    "expected_severity": "MEDIUM",
    "cwe_or_cve": "CWE-362",
    "authoritative_reference": "https://cwe.mitre.org/data/definitions/362.html",
    "preconditions": "Source code repository scan",
    "why_vulnerable": "Concurrent requests exploit file lock absence",
    "reproduction_instructions": "Trigger payload via standard HTTP request or execution",
    "known_scanner_limitations": "None"
  },
  {
    "test_id": "TP-SAST-010",
    "category": "SAST",
    "subcategory": "Reflected XSS",
    "language_or_ecosystem": "JavaScript",
    "file_path": "sast/javascript/xss_and_redirect.js",
    "line_number": 7,
    "vulnerability_description": "Unescaped query parameter directly rendered into HTML response",
    "expected_detection": "Cross-Site Scripting",
    "expected_severity": "HIGH",
    "cwe_or_cve": "CWE-79",
    "authoritative_reference": "https://cwe.mitre.org/data/definitions/79.html",
    "preconditions": "Source code repository scan",
    "why_vulnerable": "Injecting <script>alert(1)</script> executes in client browser",
    "reproduction_instructions": "Trigger payload via standard HTTP request or execution",
    "known_scanner_limitations": "None"
  },
  {
    "test_id": "TP-SAST-011",
    "category": "SAST",
    "subcategory": "Open Redirect",
    "language_or_ecosystem": "JavaScript",
    "file_path": "sast/javascript/xss_and_redirect.js",
    "line_number": 13,
    "vulnerability_description": "Unvalidated URL parameter passed directly to res.redirect",
    "expected_detection": "Open Redirect",
    "expected_severity": "MEDIUM",
    "cwe_or_cve": "CWE-601",
    "authoritative_reference": "https://cwe.mitre.org/data/definitions/601.html",
    "preconditions": "Source code repository scan",
    "why_vulnerable": "Redirecting users to malicious phishing destinations",
    "reproduction_instructions": "Trigger payload via standard HTTP request or execution",
    "known_scanner_limitations": "None"
  },
  {
    "test_id": "TP-SAST-012",
    "category": "SAST",
    "subcategory": "NoSQL Injection",
    "language_or_ecosystem": "JavaScript",
    "file_path": "sast/javascript/nosqli_and_idor.js",
    "line_number": 11,
    "vulnerability_description": "Passing raw request body object into MongoDB findOne",
    "expected_detection": "NoSQL Injection",
    "expected_severity": "HIGH",
    "cwe_or_cve": "CWE-943",
    "authoritative_reference": "https://cwe.mitre.org/data/definitions/943.html",
    "preconditions": "Source code repository scan",
    "why_vulnerable": "Passing password: {\"$ne\": null} bypasses password check",
    "reproduction_instructions": "Trigger payload via standard HTTP request or execution",
    "known_scanner_limitations": "None"
  },
  {
    "test_id": "TP-SAST-013",
    "category": "SAST",
    "subcategory": "Broken Authorization / IDOR",
    "language_or_ecosystem": "JavaScript",
    "file_path": "sast/javascript/nosqli_and_idor.js",
    "line_number": 18,
    "vulnerability_description": "Accessing document by ID without verifying requesting user's identity",
    "expected_detection": "Insecure Direct Object Reference",
    "expected_severity": "HIGH",
    "cwe_or_cve": "CWE-639",
    "authoritative_reference": "https://cwe.mitre.org/data/definitions/639.html",
    "preconditions": "Source code repository scan",